Rank;Title;Genre;Director;Actors;Year;Runtime (Minutes);Rating;Votes;Revenue (Millions);Metascore
925;Superman Returns;Action,Adventure,Sci-Fi;Bryan Singer;Brandon Routh, Kevin Spacey, Kate Bosworth, James Marsden;2006;154;6.1;246797;200.07;72
927;Precious;Drama;Lee Daniels;Gabourey Sidibe, Mo'Nique, Paula Patton, Mariah Carey;2009;110;7.3;91623;47.54;79
936;Talladega Nights: The Ballad of Ricky Bobby;Action,Comedy,Sport;Adam McKay;Will Ferrell, John C. Reilly, Sacha Baron Cohen, Gary Cole;2006;108;6.6;137502;148.21;66
937;The Human Centipede (First Sequence);Horror;Tom Six;Dieter Laser, Ashley C. Williams, Ashlynn Yennie, Akihiro Kitamura;2009;92;4.4;60655;0.18;33
940;Up in the Air;Drama,Romance;Jason Reitman;George Clooney, Vera Farmiga, Anna Kendrick,Jason Bateman;2009;109;7.4;279694;83.81;83
941;The Midnight Meat Train;Horror,Mystery;Ryûhei Kitamura;Vinnie Jones, Bradley Cooper, Leslie Bibb, Brooke Shields;2008;98;6.1;50255;0.07;58
946;Triangle;Fantasy,Mystery,Thriller;Christopher Smith;Melissa George, Joshua McIvor, Jack Taylor,Michael Dorman;2009;99;6.9;72533;0;66
955;Death Race;Action,Sci-Fi,Thriller;Paul W.S. Anderson;Jason Statham, Joan Allen, Tyrese Gibson, Ian McShane;2008;105;6.4;173731;36.06;43
960;Lucky Number Slevin;Crime,Drama,Mystery;Paul McGuigan;Josh Hartnett, Ben Kingsley, Morgan Freeman, Lucy Liu;2006;110;7.8;271940;22.49;53
963;The Other Boleyn Girl;Biography,Drama,History;Justin Chadwick;Natalie Portman, Scarlett Johansson, Eric Bana,Jim Sturgess;2008;115;6.7;88260;26.81;50
966;Inland Empire;Drama,Mystery,Thriller;David Lynch;Laura Dern, Jeremy Irons, Justin Theroux, Karolina Gruszka;2006;180;7;44227;0;72
972;Disturbia;Drama,Mystery,Thriller;D.J. Caruso;Shia LaBeouf, David Morse, Carrie-Anne Moss, Sarah Roemer;2007;105;6.9;193491;80.05;62
983;Across the Universe;Drama,Fantasy,Musical;Julie Taymor;Evan Rachel Wood, Jim Sturgess, Joe Anderson, Dana Fuchs;2007;133;7.4;95172;24.34;56
989;Martyrs;Horror;Pascal Laugier;Morjana Alaoui, Mylène Jampanoï, Catherine Bégin,Robert Toupin;2008;99;7.1;63785;0;89
991;Underworld: Rise of the Lycans;Action,Adventure,Fantasy;Patrick Tatopoulos;Rhona Mitra, Michael Sheen, Bill Nighy, Steven Mackintosh;2009;92;6.6;129708;45.8;44
992;Taare Zameen Par;Drama,Family,Music;Aamir Khan;Darsheel Safary, Aamir Khan, Tanay Chheda, Sachet Engineer;2007;165;8.5;102697;1.2;42
997;Hostel: Part II;Horror;Eli Roth;Lauren German, Heather Matarazzo, Bijou Phillips, Roger Bart;2007;94;5.5;73152;17.54;46
998;Step Up 2: The Streets;Drama,Music,Romance;Jon M. Chu;Robert Hoffman, Briana Evigan, Cassie Ventura, Adam G. Sevani;2008;98;6.2;70699;58.01;50