Rank;Title;Genre;Director;Actors;Year;Runtime (Minutes);Rating;Votes;Revenue (Millions);Metascore
980;The Skin I Live In;Drama,Thriller;Pedro Almodóvar;Antonio Banderas, Elena Anaya, Jan Cornet,Marisa Paredes;2011;120;7.6;108772;3.19;70
982;Annie;Comedy,Drama,Family;Will Gluck;Quvenzhané Wallis, Cameron Diaz, Jamie Foxx, Rose Byrne;2014;118;5.3;27312;85.91;33
984;Let's Be Cops;Comedy;Luke Greenfield;Jake Johnson, Damon Wayans Jr., Rob Riggle, Nina Dobrev;2014;104;6.5;112729;82.39;30
986;Your Highness;Adventure,Comedy,Fantasy;David Gordon Green;Danny McBride, Natalie Portman, James Franco, Rasmus Hardiker;2011;102;5.6;87904;21.56;31
987;Final Destination 5;Horror,Thriller;Steven Quale;Nicholas D'Agosto, Emma Bell, Arlen Escarpeta, Miles Fisher;2011;92;5.9;88000;42.58;50
988;Endless Love;Drama,Romance;Shana Feste;Gabriella Wilde, Alex Pettyfer, Bruce Greenwood,Robert Patrick;2014;104;6.3;33688;23.39;30
990;Selma;Biography,Drama,History;Ava DuVernay;David Oyelowo, Carmen Ejogo, Tim Roth, Lorraine Toussaint;2014;128;7.5;67637;52.07;89
993;Take Me Home Tonight;Comedy,Drama,Romance;Michael Dowse;Topher Grace, Anna Faris, Dan Fogler, Teresa Palmer;2011;97;6.3;45419;6.92;42
994;Resident Evil: Afterlife;Action,Adventure,Horror;Paul W.S. Anderson;Milla Jovovich, Ali Larter, Wentworth Miller,Kim Coates;2010;97;5.9;140900;60.13;37
995;Project X;Comedy;Nima Nourizadeh;Thomas Mann, Oliver Cooper, Jonathan Daniel Brown, Dax Flame;2012;88;6.7;164088;54.72;48
999;Search Party;Adventure,Comedy;Scot Armstrong;Adam Pally, T.J. Miller, Thomas Middleditch,Shannon Woodward;2014;93;5.6;4881;0;22