Rank;Title;Genre;Director;Actors;Year;Runtime (Minutes);Rating;Votes;Revenue (Millions);Metascore
195;Warrior;Action,Drama,Sport;Gavin O'Connor;Tom Hardy, Nick Nolte, Joel Edgerton, Jennifer Morrison;2011;140;8.2;355722;13.65;71
311;The Blind Side;Biography,Drama,Sport;John Lee Hancock;Quinton Aaron, Sandra Bullock, Tim McGraw,Jae Head;2009;129;7.7;237221;255.95;53
338;Tracktown;Drama,Sport;Alexi Pappas;Alexi Pappas, Chase Offerle, Rachel Dratch, Andy Buckley;2016;88;5.9;115;0;64
368;American Wrestler: The Wizard;Drama,Sport;Alex Ranarivelo;William Fichtner, Jon Voight, Lia Marie Johnson,Gabriel Basso;2016;117;6.9;286;0;52
378;Creed;Drama,Sport;Ryan Coogler;Michael B. Jordan, Sylvester Stallone, Tessa Thompson, Phylicia Rashad;2015;133;7.6;175673;109.71;82
382;Southpaw;Drama,Sport;Antoine Fuqua;Jake Gyllenhaal, Rachel McAdams, Oona Laurence,Forest Whitaker;2015;124;7.4;169083;52.42;57
494;Point Break;Action,Crime,Sport;Ericson Core;Edgar Ramírez, Luke Bracey, Ray Winstone, Teresa Palmer;2015;114;5.3;44553;28.77;34
549;Chuck;Biography,Drama,Sport;Philippe Falardeau;Elisabeth Moss, Naomi Watts, Ron Perlman, Liev Schreiber;2016;98;6.8;391;0.11;68
575;Bleed for This;Biography,Drama,Sport;Ben Younger;Miles Teller, Aaron Eckhart, Katey Sagal, Ciarán Hinds;2016;117;6.8;11900;4.85;62
585;Moneyball;Biography,Drama,Sport;Bennett Miller;Brad Pitt, Robin Wright, Jonah Hill, Philip Seymour Hoffman;2011;133;7.6;297395;75.61;87
587;Unbroken;Biography,Drama,Sport;Angelina Jolie;Jack O'Connell, Miyavi, Domhnall Gleeson, Garrett Hedlund;2014;137;7.2;114006;115.6;59
594;She's the Man;Comedy,Romance,Sport;Andy Fickman;Amanda Bynes, Laura Ramsey, Channing Tatum,Vinnie Jones;2006;105;6.4;122864;2.34;45
597;Never Back Down;Action,Drama,Sport;Jeff Wadlow;Sean Faris, Djimon Hounsou, Amber Heard, Cam Gigandet;2008;110;6.6;84083;24.85;39
831;Rocky Balboa;Drama,Sport;Sylvester Stallone;Sylvester Stallone, Antonio Tarver, Milo Ventimiglia, Burt Young;2006;102;7.2;171356;70.27;63
850;42;Biography,Drama,Sport;Brian Helgeland;Chadwick Boseman, T.R. Knight, Harrison Ford,Nicole Beharie;2013;128;7.5;69659;95;62
897;Concussion;Biography,Drama,Sport;Peter Landesman;Will Smith, Alec Baldwin, Albert Brooks, David Morse;2015;123;7.1;61274;34.53;55
936;Talladega Nights: The Ballad of Ricky Bobby;Action,Comedy,Sport;Adam McKay;Will Ferrell, John C. Reilly, Sacha Baron Cohen, Gary Cole;2006;108;6.6;137502;148.21;66
975;Queen of Katwe;Biography,Drama,Sport;Mira Nair;Madina Nalwanga, David Oyelowo, Lupita Nyong'o, Martin Kabanza;2016;124;7.4;6753;8.81;73